{
  "id": "e5f6a7b8-c9d0-4123-ef01-234567890123",
  "organization_id": "9b1deb4d-3b7d-4bad-9bdd-2b0d7b3dcb6d",
  "credential_template_id": "d6e7f8a9-b0c1-4234-f012-345678901234",
  "applicant_id": "b2c3d4e5-f6a7-4890-bcde-f01234567890",
  "application_id": "b2c3d4e5-f6a7-4890-bcde-f01234567891",
  "subject_did": "did:key:z6MkhaXgBZDvotDkL5257faiztiGiC2QtKLGpbnnEGta2doK",
  "status": "issued",
  "created_at": "2026-03-15T14:00:00Z",
  "expires_at": "2026-03-16T14:00:00Z",
  "issued_at": "2026-03-15T14:05:00Z",
  "revoked_at": null,
  "revocation_reason": null
}
